{
  "v": 1,
  "id": "7b7da60de6ed790d",
  "upstream": {
    "name": "openclaw",
    "version": "2026.9.33",
    "integrity": "sha512-gCwhh7Ej5/k4+/SzgHDi6HEHxw1ppDbIza3v6uSNa0JVB011m5YJ+AKmUbEFI0m4Au0pCRLK0ogL/GtUMDFMiw==",
    "commit": "5873f8174e0b2866a2b8bc0dbf4c4c8164d8dc82",
    "license": "MIT"
  },
  "files": [
    {
      "path": "dist/experience-review-ClLYopea.mjs",
      "before": "61abd547073af49bf5766c8e8679dd7e72089093edd4010cd5c4c50dde2ddd52",
      "after": "5c55b02a320b5f06d78eaba6d670bed2557564b5c21c6dfac0bc65069b98b046",
      "edits": [
        {
          "find": "import { r as getRuntimeConfig } from \"./io.runtime-FunTy0y1.mjs\";\n",
          "replace": "import { r as getRuntimeConfig } from \"./io.runtime-FunTy0y1.mjs\";\nimport { openSync as byokitOpen, writeSync as byokitWrite, fsyncSync as byokitFsync, closeSync as byokitClose } from \"node:fs\";\nimport { join as byokitJoin } from \"node:path\";\n"
        },
        {
          "find": "async function runSkillExperienceReviewInner(candidate) {\n",
          "replace": "/** BYOKit R4-1: content-free durable Gateway Workshop facts, inert without kit env. */\nfunction byokitUsageFact(fact) {\n\tconst dir = process.env.BYOKIT_ENGINE_USAGE_LEDGER;\n\tconst bootId = process.env.BYOKIT_ENGINE_BOOT;\n\tif (!dir || !bootId) return;\n\tconst key = Symbol.for(\"byokit.engine-usage.v1\");\n\tconst live = globalThis[key] ??= { bootId, months: {}, inFlight: {} };\n\tconst month = new Date(fact.at).toISOString().slice(0, 7);\n\tconst counter = live.months[month] ??= { lastSeq: 0, failed: 0 };\n\tconst seq = ++counter.lastSeq;\n\tif (fact.phase === \"started\") live.inFlight[fact.chargeId] = { startedAt: fact.startedAt };\n\telse delete live.inFlight[fact.chargeId];\n\ttry {\n\t\tconst fd = byokitOpen(byokitJoin(dir, \"engine-started-\" + month + \".jsonl\"), \"a\", 0o600);\n\t\ttry {\n\t\t\tconst line = Buffer.from(JSON.stringify({ v: 1, ...fact, bootId, seq }) + \"\\n\");\n\t\t\tif (byokitWrite(fd, line) !== line.length) throw new Error(\"short accounting write\");\n\t\t\tbyokitFsync(fd);\n\t\t} finally { byokitClose(fd); }\n\t} catch { counter.failed++; }\n}\nasync function runSkillExperienceReviewInner(candidate) {\n"
        },
        {
          "find": "\tlet outcome;\n\tlet proposalId;\n\tlet usage;\n",
          "replace": "\tlet outcome;\n\tlet proposalId;\n\tlet usage;\n\tlet byokitRunUsage;\n\tconst byokitFact = { chargeId: runId, agentId: foregroundPromptContext.agentId, kind: \"workshop-review\", provider: candidate.ctx.modelProviderId, model: candidate.ctx.modelId, ...candidate.ctx.authProfileId ? { authProfileId: candidate.ctx.authProfileId } : {}, startedAt: attemptedAtMs, origin: { sessionKey, ...candidate.ctx.runId ? { runId: candidate.ctx.runId } : {} } };\n"
        },
        {
          "find": "\t\tconst embeddedResult = capability ? await runWithCronCreatorAuthorityCapability(capability, run) : await run();\n",
          "replace": "\t\tbyokitUsageFact({ ...byokitFact, phase: \"started\", at: attemptedAtMs });\n\t\tconst embeddedResult = capability ? await runWithCronCreatorAuthorityCapability(capability, run) : await run();\n\t\tbyokitRunUsage = embeddedResult?.meta?.agentMeta?.usage;\n"
        },
        {
          "find": "\t} catch (error) {\n\t\tawait recordSkillExperienceReviewOutcome(foregroundPromptContext.agentId, workspaceDir, {\n",
          "replace": "\t} catch (error) {\n\t\tbyokitUsageFact({ ...byokitFact, phase: \"ended\", at: Date.now(), outcome: \"failed\", ...byokitRunUsage ? { usage: byokitRunUsage } : {} });\n\t\tawait recordSkillExperienceReviewOutcome(foregroundPromptContext.agentId, workspaceDir, {\n"
        },
        {
          "find": "\t\tclearAgentRunContext(runId);\n\t}\n\tawait recordSkillExperienceReviewOutcome(foregroundPromptContext.agentId, workspaceDir, {\n",
          "replace": "\t\tclearAgentRunContext(runId);\n\t}\n\tbyokitUsageFact({ ...byokitFact, phase: \"ended\", at: Date.now(), outcome, ...byokitRunUsage ? { usage: byokitRunUsage } : {} });\n\tawait recordSkillExperienceReviewOutcome(foregroundPromptContext.agentId, workspaceDir, {\n"
        }
      ]
    },
    {
      "path": "dist/main-session-recovery-state-BJukJiIA.mjs",
      "before": "8c68ab121b8145f960ad401597b812c988368a86f4a9d66e161413a1bffa27b7",
      "after": "c158b3f93bf73f262b1d2e4235904eaa76ef88ca6dcf82fc0cf556ce024d40e3",
      "edits": [
        {
          "find": "function isMainRestartRecoveryCandidate(entry, sessionKey) {",
          "replace": "// BYOKit: caller-owned task prefixes never acquire automatic restart recovery ownership.\nconst byokitAppOwnedSessionPrefixes = (() => {\n\ttry {\n\t\tconst prefixes = JSON.parse(process.env.BYOKIT_APP_OWNED_SESSION_PREFIXES ?? \"[]\");\n\t\treturn Array.isArray(prefixes) && prefixes.every((prefix) => {\n\t\t\tconst agent = typeof prefix === \"string\" && /^agent:([a-z0-9-]+):/.exec(prefix);\n\t\t\treturn agent && !`agent:${agent[1]}:main`.startsWith(prefix);\n\t\t}) ? prefixes : [];\n\t} catch { return []; }\n})();\nfunction isMainRestartRecoveryCandidate(entry, sessionKey) {\n\tif (byokitAppOwnedSessionPrefixes.some((prefix) => sessionKey.startsWith(prefix))) return false;"
        }
      ]
    },
    {
      "path": "dist/prepare.runtime--y1-AtS2.mjs",
      "edits": [
        {
          "find": "\t\tlet systemPrompt = turnRuntimeFacts?.remainingPrompt ?? transformedSystemPrompt;\n",
          "replace": "\t\tlet systemPrompt = turnRuntimeFacts?.remainingPrompt ?? transformedSystemPrompt;\n\t\t// BYOKit: Claude wire names for the Tooling list (ch-cli-tool-prefix). The Claude wire catalog\n\t\t// exposes OpenClaw tools as mcp__openclaw__<name>, so the printed Tooling list on that route must\n\t\t// use those exact names. Every other route keeps the stock prompt byte-identical; already-prefixed\n\t\t// names are never prefixed again. Order, summaries and error semantics are unchanged.\n\t\tif (!skipsTurnPreparation && isClaudeCli && promptTools.length > 0) {\n\t\t\tconst byokitBareNames = new Set(promptTools.map((tool) => tool?.name).filter((name) => typeof name === \"string\" && name.length > 0 && !name.startsWith(\"mcp__openclaw__\")));\n\t\t\tif (byokitBareNames.size > 0) {\n\t\t\t\tconst byokitLines = systemPrompt.split(\"\\n\");\n\t\t\t\tlet byokitInTooling = false;\n\t\t\t\tlet byokitToolingArmed = false;\n\t\t\t\tfor (let byokitI = 0; byokitI < byokitLines.length; byokitI++) {\n\t\t\t\t\tconst byokitLine = byokitLines[byokitI];\n\t\t\t\t\tif (byokitLine.startsWith(\"## \")) {\n\t\t\t\t\t\tbyokitInTooling = byokitLine === \"## Tooling\";\n\t\t\t\t\t\tbyokitToolingArmed = false;\n\t\t\t\t\t} else if (byokitInTooling && !byokitToolingArmed) {\n\t\t\t\t\t\tif (byokitLine === \"Tools policy-filtered. Names case-sensitive; call exact.\") byokitToolingArmed = true;\n\t\t\t\t\t} else if (byokitInTooling && byokitToolingArmed && byokitLine.startsWith(\"- \")) {\n\t\t\t\t\t\tconst byokitMatch = /^- (\\S+?)(:.*)?$/.exec(byokitLine);\n\t\t\t\t\t\tif (byokitMatch && byokitBareNames.has(byokitMatch[1])) byokitLines[byokitI] = `- mcp__openclaw__${byokitMatch[1]}${byokitMatch[2] ?? \"\"}`;\n\t\t\t\t\t}\n\t\t\t\t}\n\t\t\t\tsystemPrompt = byokitLines.join(\"\\n\");\n\t\t\t}\n\t\t}\n"
        },
        {
          "find": "import { accessSync } from \"node:fs\";\n",
          "replace": "import { accessSync, readFileSync as byokitReadFileSync } from \"node:fs\";\n\nconst BYOKIT_NATIVE_CONFLICT_ENV = [\"AI_GATEWAY_API_KEY\", \"ANTHROPIC_API_KEY\", \"AZURE_OPENAI_API_KEY\", \"DEEPSEEK_API_KEY\", \"GEMINI_API_KEY\", \"GOOGLE_GENERATIVE_AI_API_KEY\", \"GROQ_API_KEY\", \"MISTRAL_API_KEY\", \"OPENAI_API_BASE\", \"OPENAI_API_KEY\", \"OPENAI_BASE_URL\", \"OPENROUTER_API_KEY\", \"XAI_API_KEY\"];\n/** BYOKit K2: the managed native folder a bound account agent's CLI work must use, or undefined (unbound, or no table). */\nfunction byokitNativeEnv(agentId) {\n\tconst file = process.env.BYOKIT_NATIVE_ENV;\n\tif (!file || typeof agentId !== \"string\" || !agentId) return;\n\ttry {\n\t\tconst table = JSON.parse(byokitReadFileSync(file, \"utf8\"));\n\t\tconst row = table && table.v === 1 && table.accounts && typeof table.accounts === \"object\" ? table.accounts[agentId] : void 0;\n\t\treturn row && row.cli === \"claude\" && typeof row.dir === \"string\" && row.dir.startsWith(\"/\") ? row.dir : void 0;\n\t} catch {\n\t\treturn;\n\t}\n}\n"
        },
        {
          "find": "\tconst backendResolved = resolveCliBackendConfig(params.provider, params.config, { agentId: workspaceResolution.agentId });\n",
          "replace": "\tconst backendResolved = resolveCliBackendConfig(params.provider, params.config, { agentId: workspaceResolution.agentId });\n\t// BYOKit K2: a bound account runs its own native CLI folder from the kit's non-secret table. Every other run resolves\n\t// exactly as stock; the folder is set for this child only, the process environment is never touched, and another\n\t// provider's key or billing endpoint is cleared from it.\n\tconst byokitNative = backendResolved.id === \"claude-cli\" ? byokitNativeEnv(workspaceResolution.agentId) : void 0;\n\tif (byokitNative) backendResolved.config = {\n\t\t...backendResolved.config,\n\t\tenv: { ...backendResolved.config.env, CLAUDE_CONFIG_DIR: byokitNative },\n\t\tclearEnv: [...new Set([...backendResolved.config.clearEnv ?? [], ...BYOKIT_NATIVE_CONFLICT_ENV])]\n\t};\n"
        }
      ],
      "before": "4ac1b35a78ce33207105c442b9008dc6866aef3c160366e37854b5b31549aa59",
      "after": "780b92728ddac5b3799bc2051ca0cfcba98c570bef37f79b356db77a99d679ef"
    },
    {
      "path": "dist/setup-inference-ur2QGopt.mjs",
      "edits": [
        {
          "find": "import { u as toErrorObject } from \"./error-coercion-1P2One0X.mjs\";\n",